{"anim":[],"ax":[],"case":{"hash":"sha256:0dba13824f3398666aba1b27b54c01ff02d3e282b2c429a66f3869a05ed0cb49","id":"swiftui.custom-layout.recipe.gate-seeded.ca4e13f820f5d258"},"events":[{"clockId":"macos.dispatch.uptime","id":"offscreen.begin","kind":"capture-render-begin","timeNs":253586932591333},{"clockId":"macos.dispatch.uptime","id":"offscreen.end","kind":"capture-render-end","timeNs":253586946496625}],"id":"swiftui.custom-layout.recipe.gate-seeded.ca4e13f820f5d258.macos.run-003","images":[{"captureScale":1,"hash":"sha256:2d4573d71b6442b371e5df9f69a85a2e47d7f203337b5f1ac5884a9743ce054f","heightPx":32,"id":"macos.plain","widthPx":48},{"captureScale":1,"hash":"sha256:2d4573d71b6442b371e5df9f69a85a2e47d7f203337b5f1ac5884a9743ce054f","heightPx":32,"id":"macos.instrumented","widthPx":48},{"captureScale":1,"hash":"sha256:ebf7bc3bb57b9e6709cf28a424b385801fb34dcbde6692800924fcd253e5dc27","heightPx":64,"id":"macos.compositor","widthPx":48}],"kind":"capture","layout":[{"frame":{"height":32,"width":48,"x":0,"y":0},"probeTag":"swiftui.custom-layout:swiftui.custom-layout.witness","viewIdentity":"swiftui.custom-layout.witness"}],"meta":{"clock":{"clockId":"macos.dispatch.uptime","correlationHash":"sha256:ff9eea9fe54753cc99d1735254013e04fde5976e0ce1049b64a8666d9d2fcbd3"},"conditions":{"candidateOnly":true,"caseInputs":{"child-count":2,"layout-direction":"leftToRight","proposal-width":48},"channelStatus":{"animation":"NOT_ATTEMPTED: static pilot","compositorPaint":"OBSERVED","events":"OBSERVED: render clock & host window display only","externalAX":"HELD","offscreenPaint":"OBSERVED","rootHostGeometry":"OBSERVED: actual NSHostingView fitting size/bounds, not internal Layout callbacks","rootLayout":"OBSERVED","textRenderer":"NOT_APPLICABLE_OR_HELD","witnessFontResolution":"HELD: TextRenderer does not expose resolved font; CoreText control kept separate","witnessInternalLayoutCallbacks":"HELD: root adapter does not instrument witness internal Layout"},"clockScope":"same-process render interval only","observationalOnly":true},"host":{"hash":"sha256:9e50043f329abbc61cf7196eb425e868117c51c3a236ab03c6ea7e12887ba470","id":"factory.host.macos.measured"},"run":3},"platform":"macos","provenance":{"createdAt":"2026-10-11T05:03:58.904203Z","inputs":[{"hash":"sha256:729293930b6a0876ca11f86f13218bd01bc2ce3f511dbf7593612403da0e0b7e","id":"macos.capture.binary"}],"producer":"factory/native/macos","sourceHash":"sha256:b40428fb302c2d61c06548afbde34e9854fee6edfb126b7c3c5c22e75866d65b"},"text":[],"tuple":{"acceptanceConfigHash":"sha256:082fe5a160dba7d326ded1ce1fbbea5a4cc7222aa1d21c2d8778af4babbbd874","factoryVersion":"0.1-working-observation","hostHashes":{"macos":"sha256:9e50043f329abbc61cf7196eb425e868117c51c3a236ab03c6ea7e12887ba470","windows":"sha256:9812b7c0a9cb8275ba1c9530a2b091f611c4da408b5a70c93bd6244d8316e4f6"},"id":"sr1-observed-r09-20261010","macosBuild":"26A434","rendererHash":"sha256:e280f4a9fd9eca0a7b2657f72f8c322a537cee7b4c85999f6cbf7eb1f39ccc93","runtimeCommit":"be9a922028079fb8a51c6bb47299dfb6e9965d06","sdk":"/Applications/Xcode-27-RC.app/Contents/Developer/Platforms/MacOSX.platform/Developer/SDKs/MacOSX.sdk","toolchains":{"macSwift":"Apple Swift version 6.4 (swiftlang-6.4.0.34.1 clang-2100.3.34.1)\nTarget: arm64-apple-macosx27.0.0","winSwift":"Swift version 6.4 (swift-6.4-RELEASE)\r\nTarget: x86_64-unknown-windows-msvc\r\nBuild config: +assertions"}},"version":"0.1"}