{"anim":[],"ax":[{"actions":[],"bounds":{"height":38,"width":80,"x":120,"y":540},"identity":"swiftui.text.bundled-font.witness/ax/0","role":"AXStaticText","source":"external","value":"SwiftRight AV"}],"case":{"hash":"sha256:29dfb27ddce10411c9fa742d5ebaf7ebef22134e1d35e64036b5952cf2254156","id":"swiftui.text.bundled-font.recipe.gate-seeded.ca4e13f820f5d258"},"events":[{"clockId":"macos.dispatch.uptime","id":"offscreen.begin","kind":"capture-render-begin","timeNs":213046641475125},{"clockId":"macos.dispatch.uptime","id":"offscreen.end","kind":"capture-render-end","timeNs":213046670688458}],"id":"swiftui.text.bundled-font.recipe.gate-seeded.ca4e13f820f5d258.macos.run-013","images":[{"captureScale":1,"hash":"sha256:f596e8f4c5a77725acdd33243ebe34507a8854b83d35150f1d30306abaadd4f5","heightPx":38,"id":"macos.plain","widthPx":80},{"captureScale":1,"hash":"sha256:f596e8f4c5a77725acdd33243ebe34507a8854b83d35150f1d30306abaadd4f5","heightPx":38,"id":"macos.instrumented","widthPx":80},{"captureScale":1,"hash":"sha256:a7c02acecfaeee0a3e80d1d0f8ca6eb7d96ef829c1f560ae878f771ba225e9d6","heightPx":70,"id":"macos.compositor","widthPx":80}],"kind":"capture","layout":[{"frame":{"height":38,"width":80,"x":0,"y":0},"probeTag":"swiftui.text.bundled-font:swiftui.text.bundled-font.witness","viewIdentity":"swiftui.text.bundled-font.witness"}],"meta":{"clock":{"clockId":"macos.dispatch.uptime","correlationHash":"sha256:a7a2c54ce44b83ed31199d8b42791250c3eb7426ce3d684bcb681674f653d4b6"},"conditions":{"candidateOnly":true,"caseInputs":{"size":16,"weight":"medium","width":80},"channelStatus":{"animation":"NOT_ATTEMPTED: static pilot","compositorPaint":"OBSERVED","events":"OBSERVED: render clock & host window display only","externalAX":"OBSERVED","offscreenPaint":"OBSERVED","rootLayout":"OBSERVED","textRenderer":"OBSERVED","witnessFontResolution":"HELD: TextRenderer does not expose resolved font; CoreText control kept separate","witnessInternalLayoutCallbacks":"HELD: root adapter does not instrument witness internal Layout"},"clockScope":"same-process render interval only","observationalOnly":true},"host":{"hash":"sha256:9e50043f329abbc61cf7196eb425e868117c51c3a236ab03c6ea7e12887ba470","id":"factory.host.macos.measured"},"run":13},"platform":"macos","provenance":{"createdAt":"2026-10-10T17:48:12.108174Z","inputs":[{"hash":"sha256:104896834b9c506510dfa4c52533a389bbe7d38d5f20413ac1147d09ccaa629a","id":"macos.capture.binary"}],"producer":"factory/native/macos","sourceHash":"sha256:1e6aa824297cc875d9206c0f78d98abce1f3c95c94e1826ed26b8bb228011e27"},"text":[],"tuple":{"acceptanceConfigHash":"sha256:082fe5a160dba7d326ded1ce1fbbea5a4cc7222aa1d21c2d8778af4babbbd874","factoryVersion":"0.1-working-observation","hostHashes":{"macos":"sha256:9e50043f329abbc61cf7196eb425e868117c51c3a236ab03c6ea7e12887ba470","windows":"sha256:9812b7c0a9cb8275ba1c9530a2b091f611c4da408b5a70c93bd6244d8316e4f6"},"id":"sr1-observed-r09-20261010","macosBuild":"26A434","rendererHash":"sha256:e280f4a9fd9eca0a7b2657f72f8c322a537cee7b4c85999f6cbf7eb1f39ccc93","runtimeCommit":"be9a922028079fb8a51c6bb47299dfb6e9965d06","sdk":"/Applications/Xcode-27-RC.app/Contents/Developer/Platforms/MacOSX.platform/Developer/SDKs/MacOSX.sdk","toolchains":{"macSwift":"Apple Swift version 6.4 (swiftlang-6.4.0.34.1 clang-2100.3.34.1)\nTarget: arm64-apple-macosx27.0.0","winSwift":"Swift version 6.4 (swift-6.4-RELEASE)\r\nTarget: x86_64-unknown-windows-msvc\r\nBuild config: +assertions"}},"version":"0.1"}