{"anim":[],"ax":[{"actions":[],"bounds":{"height":31,"width":32,"x":120,"y":{"$decimal":"540.5"}},"identity":"swiftui.image.witness/ax/0","label":"Favorite","role":"AXImage","source":"external"}],"case":{"hash":"sha256:a3e936cc5f688ebd885ba817e4f0b3b4df84e3b48f6bf6b0e2c92632f5dc93b4","id":"swiftui.image.recipe.gate-seeded.ca4e13f820f5d258"},"events":[{"clockId":"macos.dispatch.uptime","id":"offscreen.begin","kind":"capture-render-begin","timeNs":260984341787125},{"clockId":"macos.dispatch.uptime","id":"offscreen.end","kind":"capture-render-end","timeNs":260984373955291}],"id":"swiftui.image.recipe.gate-seeded.ca4e13f820f5d258.macos.run-004","images":[{"captureScale":2,"hash":"sha256:22c11f5669d0f025c5707a20f225cb413784439bbfb53ff0143d783ac21c7ee2","heightPx":64,"id":"macos.plain","widthPx":64},{"captureScale":2,"hash":"sha256:22c11f5669d0f025c5707a20f225cb413784439bbfb53ff0143d783ac21c7ee2","heightPx":64,"id":"macos.instrumented","widthPx":64},{"captureScale":1,"hash":"sha256:0d429a40b46c5a7115ff62ffcee5202a2082cf3372774fd1d45c085963db7db7","heightPx":64,"id":"macos.compositor","widthPx":32}],"kind":"capture","layout":[{"frame":{"height":32,"width":32,"x":0,"y":0},"probeTag":"swiftui.image:swiftui.image.witness","viewIdentity":"swiftui.image.witness"}],"meta":{"clock":{"clockId":"macos.dispatch.uptime","correlationHash":"sha256:5147dbe39276b05d9b4b62a111434ed82d1ea4884b2f91c309d109cfa0e416ef"},"conditions":{"candidateOnly":true,"caseInputs":{"color-scheme":"dark","scale":2},"channelStatus":{"animation":"NOT_ATTEMPTED: static pilot","compositorPaint":"OBSERVED","events":"OBSERVED: render clock & host window display only","externalAX":"OBSERVED","offscreenPaint":"OBSERVED","rootHostGeometry":"OBSERVED: actual NSHostingView fitting size/bounds, not internal Layout callbacks","rootLayout":"OBSERVED","textRenderer":"NOT_APPLICABLE_OR_HELD","witnessFontResolution":"HELD: TextRenderer does not expose resolved font; CoreText control kept separate","witnessInternalLayoutCallbacks":"HELD: root adapter does not instrument witness internal Layout"},"clockScope":"same-process render interval only","observationalOnly":true},"host":{"hash":"sha256:9e50043f329abbc61cf7196eb425e868117c51c3a236ab03c6ea7e12887ba470","id":"factory.host.macos.measured"},"run":4},"platform":"macos","provenance":{"createdAt":"2026-10-11T07:07:26.339416Z","inputs":[{"hash":"sha256:3eeaa2e933a54b06642d70c55cc989e646874c6a1c98f7750ae7bccdea3aa2c3","id":"macos.capture.binary"}],"producer":"factory/native/macos","sourceHash":"sha256:9fcf054bfd9de2fadf0198482130b06bb186b230536c4b1d2521609c9aca227d"},"text":[],"tuple":{"acceptanceConfigHash":"sha256:082fe5a160dba7d326ded1ce1fbbea5a4cc7222aa1d21c2d8778af4babbbd874","factoryVersion":"0.1-working-observation","hostHashes":{"macos":"sha256:9e50043f329abbc61cf7196eb425e868117c51c3a236ab03c6ea7e12887ba470","windows":"sha256:9812b7c0a9cb8275ba1c9530a2b091f611c4da408b5a70c93bd6244d8316e4f6"},"id":"sr1-observed-r09-20261010","macosBuild":"26A434","rendererHash":"sha256:e280f4a9fd9eca0a7b2657f72f8c322a537cee7b4c85999f6cbf7eb1f39ccc93","runtimeCommit":"be9a922028079fb8a51c6bb47299dfb6e9965d06","sdk":"/Applications/Xcode-27-RC.app/Contents/Developer/Platforms/MacOSX.platform/Developer/SDKs/MacOSX.sdk","toolchains":{"macSwift":"Apple Swift version 6.4 (swiftlang-6.4.0.34.1 clang-2100.3.34.1)\nTarget: arm64-apple-macosx27.0.0","winSwift":"Swift version 6.4 (swift-6.4-RELEASE)\r\nTarget: x86_64-unknown-windows-msvc\r\nBuild config: +assertions"}},"version":"0.1"}