{"anim":[],"ax":[{"actions":[],"bounds":{"height":16,"width":9,"x":120,"y":540},"identity":"swiftui.preference-key.witness/ax/0","role":"AXStaticText","source":"external","value":"0"},{"actions":[],"bounds":{"height":16,"width":6,"x":{"$decimal":"121.5"},"y":556},"identity":"swiftui.preference-key.witness/ax/1","role":"AXStaticText","source":"external","value":"1"}],"case":{"hash":"sha256:d908821e18c8ad4e45eed24b446cf3d126fdbf18e17030be45bbbb7105b8459c","id":"swiftui.preference-key.recipe.gate-seeded.ca4e13f820f5d258"},"events":[{"clockId":"macos.dispatch.uptime","id":"offscreen.begin","kind":"capture-render-begin","timeNs":213155717540833},{"clockId":"macos.dispatch.uptime","id":"offscreen.end","kind":"capture-render-end","timeNs":213155742557750}],"id":"swiftui.preference-key.recipe.gate-seeded.ca4e13f820f5d258.macos.run-007","images":[{"captureScale":1,"hash":"sha256:9e099124fae48d5b36b096a07759ce45bf0cbfc2283037088c050f974ca9d644","heightPx":33,"id":"macos.plain","widthPx":9},{"captureScale":1,"hash":"sha256:9e099124fae48d5b36b096a07759ce45bf0cbfc2283037088c050f974ca9d644","heightPx":33,"id":"macos.instrumented","widthPx":9},{"captureScale":1,"hash":"sha256:412dd7bdcf161cfbf78a797f2c924a97f8d565d0008546600165ff23092d4d4a","heightPx":64,"id":"macos.compositor","widthPx":9}],"kind":"capture","layout":[{"frame":{"height":33,"width":9,"x":0,"y":0},"probeTag":"swiftui.preference-key:swiftui.preference-key.witness","viewIdentity":"swiftui.preference-key.witness"}],"meta":{"clock":{"clockId":"macos.dispatch.uptime","correlationHash":"sha256:d478d33e5aefbee5a12b5c9fa4af8d115d40b9809038747a8059b489b2503ab3"},"conditions":{"candidateOnly":true,"caseInputs":{"child-count":2,"reduction":"max"},"channelStatus":{"animation":"NOT_ATTEMPTED: static pilot","compositorPaint":"OBSERVED","events":"OBSERVED: render clock & host window display only","externalAX":"OBSERVED","offscreenPaint":"OBSERVED","rootLayout":"OBSERVED","textRenderer":"OBSERVED","witnessFontResolution":"HELD: TextRenderer does not expose resolved font; CoreText control kept separate","witnessInternalLayoutCallbacks":"HELD: root adapter does not instrument witness internal Layout"},"clockScope":"same-process render interval only","observationalOnly":true},"host":{"hash":"sha256:9e50043f329abbc61cf7196eb425e868117c51c3a236ab03c6ea7e12887ba470","id":"factory.host.macos.measured"},"run":7},"platform":"macos","provenance":{"createdAt":"2026-10-10T17:50:05.100482Z","inputs":[{"hash":"sha256:b7a0fb6e9e7fc8d6bea63169d8243802b76bdaa25aae3c12966d86708d9b934e","id":"macos.capture.binary"}],"producer":"factory/native/macos","sourceHash":"sha256:8d317a4cebacb3ec7f48f0797a2c4f87dfb49f2bef9c94c6c7819ef3d37bb84a"},"text":[],"tuple":{"acceptanceConfigHash":"sha256:082fe5a160dba7d326ded1ce1fbbea5a4cc7222aa1d21c2d8778af4babbbd874","factoryVersion":"0.1-working-observation","hostHashes":{"macos":"sha256:9e50043f329abbc61cf7196eb425e868117c51c3a236ab03c6ea7e12887ba470","windows":"sha256:9812b7c0a9cb8275ba1c9530a2b091f611c4da408b5a70c93bd6244d8316e4f6"},"id":"sr1-observed-r09-20261010","macosBuild":"26A434","rendererHash":"sha256:e280f4a9fd9eca0a7b2657f72f8c322a537cee7b4c85999f6cbf7eb1f39ccc93","runtimeCommit":"be9a922028079fb8a51c6bb47299dfb6e9965d06","sdk":"/Applications/Xcode-27-RC.app/Contents/Developer/Platforms/MacOSX.platform/Developer/SDKs/MacOSX.sdk","toolchains":{"macSwift":"Apple Swift version 6.4 (swiftlang-6.4.0.34.1 clang-2100.3.34.1)\nTarget: arm64-apple-macosx27.0.0","winSwift":"Swift version 6.4 (swift-6.4-RELEASE)\r\nTarget: x86_64-unknown-windows-msvc\r\nBuild config: +assertions"}},"version":"0.1"}